Type,electric efficiency,thermal efficiency,cost per m2,cost per kWp,life cycle GHG factor kgCO2eq per m2,life cycle GHG factor kgCO2eq per kWp,Lifetime,Description,ignore_category,ignore_module description,ignore_cell technology,ignore_module film tint,ignore_module weight (kg),ignore_module dimensions,ignore_module area (sqm.),ignore_module density (kg/sqm.),ignore_module rating(Wp),ignore_module efficiency,ignore_Euro per Wp (installed),ignore_Euro per sqm.,ignore_power density (Wp/sqm),ignore_GWP Intensity (kgCO2eq per m2),ignore_GWP (kgCO2eq per kWp),ignore_Product,ignore_Source URL,ignore_Producer Region,ignore_Cost Notes,ignore_Efficiency Notes,ignore_GWP Notes,ignore_Image
attached Monocrystalline,0.188,0,384.8973607,1750,107.111437,487,30,"Polycristalline modules consist of silicon wafer based cells that typically come in classic blue or black color. The PV cell wafers consist of multiple smaller crystals, which can show as a camouflage-like pattern on the cells. Generally, they can be colored more easily than monocrystalline cells and are slightly less expensive but also less efficient than monocrystalline cells. This type of PV is, with some exceptions, not suitable for curved applications. Customized designs (size, shape and colors) of cells and modules are possible at the expense of efficiency losses and increased costs.",attached,Standard Monocrystalline Attached Module,Monocrystalline,None,18.9,1650x992x40 mm,1.6368,11.54692082,360,18.8,1.75,384.8973607,219.941349,107.111437,487,,,Global Mean,Cell cost is 0.24 EUR/Wp. Total cost based on 2019 cost for installed residential system for Germany from https://ec.europa.eu/jrc/sites/default/files/kjna29938enn_1.pdf (3.3) and compared to https://www.pv-magazine.com/module-price-index/ ,,https://doi.org/10.1016/j.solmat.2021.111277 supplemental,monocrystalline
attached Polycrystalline Silicon,0.16,0,381.5594974,1770,104.9827544,487,30,"Monocristalline PV modules consist of silicon wafer based cells that typically come in classic blue or black color. It is currently the most popular PV cell technology. The cells usually have rounded corners due to production processes. Monocristalline PV modules are more efficient and also more expensive compared to polycrystalline modules. This type of PV is, with some exceptions, not suitable for curved applications. Customized designs (size, shape and colors) of cells and modules are possible at the expense of efficiency losses and increased costs.",attached,Standard Polycrystalline Attached Module,Polycrystalline SIlicon,None,19.96,1640x990x35 mm,1.6236,12.29366839,350,16,1.77,381.5594974,215.5703375,104.9827544,487,,,Global Mean,Additional cost per watt of cell compared to mono cell (base cost of poly cell of at 0.22 EUR/Wp) is added to the total BOS for Mono ,,https://doi.org/10.1016/j.solmat.2021.111277 supplemental,polycrystalline
attached CdTe,0.173,0,436.0653035,2510,65.14919874,375,30,"CIGS modules can be very thin, as they are not based on wafers but on deposited thin-films. This makes them flexible and suitable for applications on curved surfaces. They are of black color and modules often do not have visible spacing between cells, making a more homogeneous impression. Current modules do not reach efficiencies similar to silicon based modules and prices can still be high. The technology is expected to keep improving in the near future. Compared to crystalline silicon cells, thin-film CIGS cells show substantially lower green-house gas emissions but higher human toxicity.",attached,Standard CdTe Thin Film Attached Module,CdTe,None,34.5,2009x1232x49 mm,2.475088,13.93889833,430,17.3,2.51,436.0653035,173.7311966,65.14919874,375,,,Global Mean,Additional cost per watt of cell compared to mono cell (base cost of CdTe cell of at 1.00 EUR/Wp) is added to the total BOS for Mono ,,https://www.epd-norge.no/getfile.php/1319702-1628246534/EPDer/Byggevarer/NEPD-2993-1671_Series-6-Photovoltaic-Module.pdf ,cdte
attached CIGS,0.142,0,464.419654,3260,92.59901077,650,30,"CdTe based modules can be very thin, as they are not based on wafers but on deposited thin-films. They exist in rigid and flexible form and are usually of black color. The appearance is homogeneous as there is no spacing between cells. Efficiencies are not yet as high as for silicon based cells but improving rapidly. Compared to crystalline silicon cells, thin-film CdTe cells show substantially lower green-house gas emissions but higher human toxicity.",attached,Standard CIGS Thin Film Attached Module,CIGS,None,33.3,1901x1237x45 mm,2.351537,14.1609509,335,14.2,3.26,464.419654,142.4600166,92.59901077,650,,,Global Mean,Additional cost per watt of cell compared to mono cell (base cost of CIS cell of at 1.75 EUR/Wp) is added to the total BOS for Mono ,,https://doi.org/10.3390/en9080622,cigs
attached Amorphous Silicon,0.08,0,158.1046756,2510,80,1270.04,30,"Amorphous silicon (a-Si) is the non-crystalline allotropic form of the semiconductor silicon. It has a high absorption capacity and can therefore be used in solar cells with very small layer thicknesses (usually about a factor of 100 smaller than in crystalline silicon), saving on material costs and compensating for performance deficiencies caused by its comparably low industry-maximum efficiency which is about 13%.",attached,Standard a-SI Thin Film Attached Module,Amorphous Silicon,None,35,2599x2199x34.2 mm,5.715201,6.124019085,360,8,2.51,158.1046756,62.98991059,80,1270.04,,,Global Mean,Additional cost per watt of cell compared to mono cell (base cost of a-Si cell of at 1.00 EUR/Wp) is added to the total BOS for Mono ,,https://doi.org/10.1080/15435075.2018.1510408,asi
attached Heterojunction Monocrystalline,0.2103,0,392.5079775,1850,144.2732025,680,30,"HIT modules consist of silicon wafer based cells with an additional intrinsic silicon layer. From an aesthetic point of view, they are similar to monocrystalline modules showing the classic blue or black colors. The additional layer leads to an increased efficiency but also to higher cost. This type of PV is generally not suitable for curved applications.",attached,Standard HJT Monocrystalline Attached Module,Heterojunction Monocrystalline,None,28.98,2288x1133x35 mm,2.592304,11.17924441,550,21.03,1.85,392.5079775,212.1664743,144.2732025,680,,,Global Mean,Additional cost per watt of cell compared to mono cell (base cost of HIT cell of at 0.34 EUR/Wp) is added to the total BOS for Mono  Base cost found here https://www.pv-magazine.com/2021/07/09/eu-spot-market-module-prices-climate-targets-pv-price-trends-for-2030-a-viable-mix/,,https://doi.org/10.1016/j.solmat.2021.111277 supplemental,hjt
attached flexible CIGS,0.11,0,355.0412661,3260,17.5,160.6855469,30,A benefit of thin film photovoltaic cells is their ability to be produced in a manner that permits flexible modules. These flexible CIGS panels can be applied to curved surfaces with ease. They are also exceptionally light and benefit from no heavy weight or carbon intensive frame.,attached,Flexible CIGS Thin Film Attached Module,flexible CIGS,None,4,4025x365x mm,1.469125,2.722709096,160,11,3.26,355.0412661,108.9083638,17.5,160.6855469,midsummer,https://midsummer.se/wp-content/uploads/2021/10/Product_sheet_MidsummerSLIM_EN_211022.pdf,Global Mean,Additional cost per watt of cell compared to mono cell (base cost of HIT cell of at 0.34 EUR/Wp) is added to the total BOS for Mono  Base cost found here https://www.pv-magazine.com/2021/07/09/eu-spot-market-module-prices-climate-targets-pv-price-trends-for-2030-a-viable-mix/,,https://midsummer.se/wp-content/uploads/2021/10/Product_sheet_MidsummerSLIM_EN_211022.pdf,flexible_cigs